{
  "eventId": "evt-0011",
  "runId": "run-0001",
  "sequence": 11,
  "occurredAt": "2026-08-07T12:34:56.789Z",
  "schemaVersion": 1,
  "source": {
    "type": "harness",
    "adapter": "fixture",
    "version": "1.0.0"
  },
  "sensitivity": "operational",
  "extensions": {},
  "kind": "diagnostic.emitted",
  "payload": {
    "code": "HARNESS_EXIT",
    "severity": "warning",
    "retryable": false
  }
}
