{
  "eventId": "evt-0001",
  "runId": "run-0001",
  "sequence": 1,
  "occurredAt": "2026-08-07T12:34:56.789Z",
  "schemaVersion": 1,
  "source": {
    "type": "harness",
    "adapter": "fixture",
    "version": "1.0.0"
  },
  "sensitivity": "operational",
  "extensions": {},
  "kind": "run.lifecycle",
  "payload": {
    "state": "running",
    "attemptId": "attempt-1"
  }
}
