{
  "eventId": "evt-0012",
  "runId": "run-0001",
  "sequence": 12,
  "occurredAt": "2026-08-07T12:34:56.789Z",
  "schemaVersion": 1,
  "source": {
    "type": "harness",
    "adapter": "fixture",
    "version": "1.0.0"
  },
  "sensitivity": "operational",
  "extensions": {},
  "kind": "workflow.linked",
  "payload": {
    "workflowId": "workflow-1",
    "stepId": "step-1",
    "relation": "produced",
    "attempt": 1
  }
}
