{
  "eventId": "evt-0006",
  "runId": "run-0001",
  "sequence": 6,
  "occurredAt": "2026-08-07T12:34:56.789Z",
  "schemaVersion": 1,
  "source": {
    "type": "harness",
    "adapter": "fixture",
    "version": "1.0.0"
  },
  "sensitivity": "operational",
  "extensions": {},
  "kind": "approval.requested",
  "payload": {
    "approvalId": "approval-1",
    "action": "run-command",
    "summary": "Run the requested command"
  }
}
