{
  "eventId": "evt-0007",
  "runId": "run-0001",
  "sequence": 7,
  "occurredAt": "2026-08-07T12:34:56.789Z",
  "schemaVersion": 1,
  "source": {
    "type": "harness",
    "adapter": "fixture",
    "version": "1.0.0"
  },
  "sensitivity": "operational",
  "extensions": {},
  "kind": "approval.resolved",
  "payload": {
    "approvalId": "approval-1",
    "decision": "approved",
    "commandId": "command-1"
  }
}
