{
  "eventId": "evt-0009",
  "runId": "run-0001",
  "sequence": 9,
  "occurredAt": "2026-08-07T12:34:56.789Z",
  "schemaVersion": 1,
  "source": {
    "type": "harness",
    "adapter": "fixture",
    "version": "1.0.0"
  },
  "sensitivity": "operational",
  "extensions": {},
  "kind": "artifact.published",
  "payload": {
    "artifactId": "artifact-1",
    "mediaType": "text/plain",
    "size": 3,
    "digest": "sha256:aaaaaaaaaaaaaaaaaaaaaaaaaaaaaaaaaaaaaaaaaaaaaaaaaaaaaaaaaaaaaaaa"
  }
}
