{
  "eventId": "evt-0008",
  "runId": "run-0001",
  "sequence": 8,
  "occurredAt": "2026-08-07T12:34:56.789Z",
  "schemaVersion": 1,
  "source": {
    "type": "harness",
    "adapter": "fixture",
    "version": "1.0.0"
  },
  "sensitivity": "operational",
  "extensions": {},
  "kind": "file.changed",
  "payload": {
    "changeId": "change-1",
    "operation": "modified",
    "path": "README.md"
  }
}
